{"argumentsBase64":"eyJjb3VudCI6IjEwMCIsImZyb21Nb3ZpZVRpY2siOiI0MiJ9","clientId":"client-1","commandId":"getTimeline","expectedMovieTick":"42","expectedRuntimeMode":"","idempotencyKey":"key-1","leaseId":"","manifestSha256":"0123456789abcdef0123456789abcdef0123456789abcdef0123456789abcdef","requestId":"request-1","requiredScope":"observe.timeline","schemaVersion":"1","sessionId":"session-1"}
